{
  "$schema": "./schemas/design.schema.json",
  "background": "#07090b",
  "text": "#e8e8e4",
  "muted": "#9aa5ac",
  "accent": "#c7a66e",
  "line": "#ccd8df",
  "panel": "#101722",
  "cardPaper": "#f1eee6",
  "cardImage": "#deded1",
  "cardGrid": "#bdc2b1",
  "cardGraph": "#394731",
  "cardText": "#252821",
  "cardSubtitle": "#3b4137",
  "placeholder": "#6a7958",
  "fontFamily": "Arial, \"PingFang SC\", \"Microsoft YaHei\", sans-serif",
  "bodySize": 16,
  "titleSize": 24,
  "brandSize": 38,
  "panelWidth": 350,
  "panelRadius": 14,
  "panelPadding": 22,
  "panelBlur": 24,
  "panelOpacity": 0.65,
  "previewImageFraction": 0.3333333333333333,
  "numberSize": 14,
  "numberHeight": 32,
  "groupSize": 36,
  "contentWidth": 860,
  "detailBodySize": 17,
  "mobilePreviewHeight": 82,
  "showIntro": true,
  "showTopics": true,
  "showPreview": true,
  "showNavigation": true,
  "showHints": true,
  "showFooter": true,
  "showCollection": true,
  "uiScale": 1.5
}
